{
  "$ref": "#/definitions/pages",
  "definitions": {
    "pages": {
      "type": "object",
      "properties": {
        "slug": {
          "type": "string"
        },
        "title": {
          "type": "string"
        },
        "date": {
          "type": "string"
        },
        "content": {
          "type": "string"
        },
        "excerpt": {
          "type": "string"
        },
        "hero": {
          "type": "string"
        },
        "parent": {
          "type": "string"
        },
        "$schema": {
          "type": "string"
        }
      },
      "required": [
        "slug",
        "title",
        "date",
        "content"
      ],
      "additionalProperties": false
    }
  },
  "$schema": "http://json-schema.org/draft-07/schema#"
}