{
  "slug": "canada-aerogel-distributors-directory",
  "title": "Canada Aerogel Distributors Directory",
  "date": "Fri, 17 Apr 2026 11:11:45 +0000",
  "content": "<!-- wp:heading {\"level\":1} -->\n<h1 class=\"wp-block-heading\">Canada Aerogel Distributors Directory</h1>\n<!-- /wp:heading -->\n\n<!-- wp:paragraph -->\n<p>This landing page collects live Aerogela listings for Canada filtered to aerogel distributors. It is designed for buyers, researchers, and sourcing teams who want a faster path to country-specific supplier discovery.</p>\n<!-- /wp:paragraph -->\n\n<!-- wp:paragraph -->\n<p>Current directory count: <strong>4 listings</strong>. For broader market context, also read <a href=\"https://aerogela.com/usa-aerogel-suppliers/\">our related Canada market guide</a> and browse the main <a href=\"https://aerogela.com/canada-aerogel-companies/\">Canada aerogel companies page</a> when available.</p>\n<!-- /wp:paragraph -->\n\n<!-- wp:heading -->\n<h2 class=\"wp-block-heading\">Listed companies</h2>\n<!-- /wp:heading -->\n\n<!-- wp:list -->\n<ul>\n<li><a href=\"https://aerogela.com/listing/cbt-group-kavi-insulation/\">CBT Group / Kavi Insulation</a></li>\n<li><a href=\"https://aerogela.com/listing/acquire-industries/\">ACQUIRE Industries</a></li>\n<li><a href=\"https://aerogela.com/listing/crossroads-ci/\">Crossroads C&#038;I</a></li>\n<li><a href=\"https://aerogela.com/listing/specialty-products-and-insulation-spi/\">Specialty Products and Insulation (SPI)</a></li>\n</ul>\n<!-- /wp:list -->\n\n<!-- wp:heading -->\n<h2 class=\"wp-block-heading\">How to use this page</h2>\n<!-- /wp:heading -->\n\n<!-- wp:list -->\n<ul><li>Open each company profile for details and official website links.</li><li>Compare supplier role, product focus, and market fit.</li><li>Use the companion market guide to understand the country-level aerogel landscape.</li></ul>\n<!-- /wp:list -->\n\n<!-- wp:heading -->\n<h2 class=\"wp-block-heading\">FAQ</h2>\n<!-- /wp:heading -->\n<!-- wp:heading {\"level\":3} -->\n<h3 class=\"wp-block-heading\">What is this directory page for?</h3>\n<!-- /wp:heading -->\n<!-- wp:paragraph -->\n<p>This page helps users review Aerogela listings in Canada that match the aerogel distributors filter.</p>\n<!-- /wp:paragraph -->\n<!-- wp:heading {\"level\":3} -->\n<h3 class=\"wp-block-heading\">Does this page include every aerogel company in Canada?</h3>\n<!-- /wp:heading -->\n<!-- wp:paragraph -->\n<p>No. It includes companies currently listed on Aerogela that match the live taxonomy filters used for this page.</p>\n<!-- /wp:paragraph -->\n<!-- wp:heading {\"level\":3} -->\n<h3 class=\"wp-block-heading\">How should buyers use this list?</h3>\n<!-- /wp:heading -->\n<!-- wp:paragraph -->\n<p>Use it as a starting point for supplier research, then review each full listing and official website before contacting the company.</p>\n<!-- /wp:paragraph -->",
  "excerpt": "",
  "parent": "0"
}