{
  "slug": "industrial-insulation-aerogel-companies",
  "title": "Industrial Insulation Aerogel Companies",
  "date": "Fri, 17 Apr 2026 11:31:57 +0000",
  "content": "<!-- wp:heading {\"level\":1} -->\n<h1 class=\"wp-block-heading\">Industrial Insulation Aerogel Companies</h1>\n<!-- /wp:heading -->\n\n<!-- wp:paragraph -->\n<p>This page groups Aerogela listings associated with industrial insulation, one of the largest and highest-intent aerogel application segments. This page is built from live Aerogela listing taxonomies so users can find relevant suppliers faster.</p>\n<!-- /wp:paragraph -->\n\n<!-- wp:paragraph -->\n<p>Current directory count: <strong>27 listings</strong>. For market and educational context, also read <a href=\"https://aerogela.com/aerogel-insulation-for-industrial-pipes/\">the related guide on Aerogela</a> and continue through the <a href=\"https://aerogela.com/listings/\">main listings directory</a>.</p>\n<!-- /wp:paragraph -->\n\n<!-- wp:heading -->\n<h2 class=\"wp-block-heading\">Listed companies</h2>\n<!-- /wp:heading -->\n\n<!-- wp:list -->\n<ul>\n<li><a href=\"https://aerogela.com/listing/hubei-xingfa-chemicals-aerogel/\">Hubei Xingfa Chemicals Group Co., Ltd. | China Aerogel Materials Manufacturer</a></li>\n<li><a href=\"https://aerogela.com/listing/guangzhou-lingwei-technology-aerogel/\">Guangzhou Lingwei Technology Co., Ltd. | China Aerogel Materials Manufacturer</a></li>\n<li><a href=\"https://aerogela.com/listing/jinsanjiang-silica-materials-aerogel/\">Jinsanjiang Silica Materials Co., Ltd. | China Aerogel Materials Manufacturer</a></li>\n<li><a href=\"https://aerogela.com/listing/winsell-energy-saving-group-aerogel/\">Winsell Energy Saving Group Co., Ltd. | China Aerogel Materials Manufacturer</a></li>\n<li><a href=\"https://aerogela.com/listing/xiamen-namate-new-materials-technology/\">Xiamen Namate New Materials Technology Co., Ltd. | China Aerogel Manufacturer</a></li>\n<li><a href=\"https://aerogela.com/listing/jiangxi-hungpai-new-materials-aerogel/\">Jiangxi Hungpai New Materials Co., Ltd. | China Aerogel Materials Manufacturer</a></li>\n<li><a href=\"https://aerogela.com/listing/jiangxi-chenguang-new-materials-aerogel/\">Jiangxi Chenguang New Materials Co., Ltd. | China Aerogel Materials Manufacturer</a></li>\n<li><a href=\"https://aerogela.com/listing/shanghai-grandnew-materials-technology/\">Shanghai Grandnew Materials Technology Co., Ltd. | China Aerogel Manufacturer</a></li>\n<li><a href=\"https://aerogela.com/listing/shaanxi-mengchuang-nano-materials/\">Shaanxi Mengchuang Nano New Materials Co., Ltd. | China Aerogel Manufacturer</a></li>\n<li><a href=\"https://aerogela.com/listing/zhejiang-ugoo-technology/\">Zhejiang Ugoo Technology Co., Ltd. | China Aerogel Manufacturer</a></li>\n<li><a href=\"https://aerogela.com/listing/hebei-jinna-low-carbon-materials/\">Hebei Jinna Low-Carbon Materials Co., Ltd. | China Aerogel Manufacturer</a></li>\n<li><a href=\"https://aerogela.com/listing/shenzhen-zhongning-technology/\">Shenzhen Zhongning Technology Co., Ltd. | China Aerogel Manufacturer</a></li>\n<li><a href=\"https://aerogela.com/listing/shandong-luyang-energy-saving-materials/\">Shandong Luyang Energy-Saving Materials Co., Ltd. | China Aerogel Materials Manufacturer</a></li>\n<li><a href=\"https://aerogela.com/listing/zhongke-runzi-technology/\">Zhongke Runzi Technology Co., Ltd. | China Aerogel Manufacturer</a></li>\n<li><a href=\"https://aerogela.com/listing/gongyi-van-research-composite-material/\">Gongyi Van-Research Composite Material Co., Ltd. | China Aerogel Manufacturer</a></li>\n<li><a href=\"https://aerogela.com/listing/anhui-key-nano-new-material-technology/\">Anhui Key-Nano New Material Technology Co., Ltd. | China Aerogel Manufacturer</a></li>\n<li><a href=\"https://aerogela.com/listing/langgu-beijing-new-material-technology/\">Langgu (Beijing) New Material Technology Co., Ltd. | China Aerogel Manufacturer</a></li>\n<li><a href=\"https://aerogela.com/listing/jiangsu-jiayun-new-materials/\">Jiangsu Jiayun New Materials Co., Ltd. | China Aerogel Manufacturer</a></li>\n<li><a href=\"https://aerogela.com/listing/pan-asia-microvent/\">Jiangsu Pan-Asia Microvent Tech Corporation | China Aerogel Manufacturer</a></li>\n<li><a href=\"https://aerogela.com/listing/zhengzhou-exceed-new-materials/\">Zhengzhou Exceed New Technologies Co., Ltd. | China Aerogel Manufacturer</a></li>\n<li><a href=\"https://aerogela.com/listing/sino-aerogel-zhongke-huaan/\">Sino-Aerogel (Zhongke Huaan) | China Aerogel Manufacturer</a></li>\n<li><a href=\"https://aerogela.com/listing/shanghai-aerogelzone-technology/\">Shanghai Aerogelzone Technology Co., Ltd. | China Aerogel Manufacturer</a></li>\n<li><a href=\"https://aerogela.com/listing/hong-hitech-beijing-co-ltd/\">Hong Hitech (Beijing) Co., Ltd. | China Aerogel Manufacturer</a></li>\n<li><a href=\"https://aerogela.com/listing/ningbo-surnano-aerogel-co-ltd/\">Ningbo Surnano Aerogel Co., Ltd. | China Aerogel Manufacturer</a></li>\n<li><a href=\"https://aerogela.com/listing/ibih-advanced-material-co-ltd/\">IBIH Advanced Materials Co., Ltd. | China Aerogel Manufacturer</a></li>\n<li><a href=\"https://aerogela.com/listing/guangdong-alison-hi-tech-co-ltd/\">Guangdong Alison Technology Co., Ltd. | China Aerogel Manufacturer</a></li>\n<li><a href=\"https://aerogela.com/listing/nano-high-tech/\">Nano High-Tech Co., Ltd. | China Aerogel Manufacturer</a></li>\n</ul>\n<!-- /wp:list -->\n\n<!-- wp:heading -->\n<h2 class=\"wp-block-heading\">How to use this page</h2>\n<!-- /wp:heading -->\n\n<!-- wp:list -->\n<ul><li>Open company profiles to review positioning and official websites.</li><li>Compare supplier role, product format, and application fit.</li><li>Use the related guide to understand the wider product or application context.</li></ul>\n<!-- /wp:list -->\n\n<!-- wp:heading -->\n<h2 class=\"wp-block-heading\">FAQ</h2>\n<!-- /wp:heading -->\n<!-- wp:heading {\"level\":3} -->\n<h3 class=\"wp-block-heading\">What is this page for?</h3>\n<!-- /wp:heading -->\n<!-- wp:paragraph -->\n<p>This page helps users review Aerogela listings that match a specific aerogel product or application filter.</p>\n<!-- /wp:paragraph -->\n<!-- wp:heading {\"level\":3} -->\n<h3 class=\"wp-block-heading\">Are these all direct manufacturers?</h3>\n<!-- /wp:heading -->\n<!-- wp:paragraph -->\n<p>Not always. Depending on the filter, results may include producers, distributors, or other aerogel-relevant companies.</p>\n<!-- /wp:paragraph -->\n<!-- wp:heading {\"level\":3} -->\n<h3 class=\"wp-block-heading\">How should buyers use this list?</h3>\n<!-- /wp:heading -->\n<!-- wp:paragraph -->\n<p>Use the directory as a starting point, then review each listing and official source before procurement outreach.</p>\n<!-- /wp:paragraph -->",
  "excerpt": "",
  "parent": "0"
}