{
  "slug": "home",
  "title": "Home",
  "date": "Tue, 19 Oct 2021 17:03:52 +0000",
  "content": "<!-- wp:heading {\"textAlign\":\"center\",\"level\":1} -->\n<h1 class=\"wp-block-heading has-text-align-center\">Aerogel Manufacturers, Suppliers, and Industry Insights</h1>\n<!-- /wp:heading -->\n\n<!-- wp:paragraph {\"align\":\"center\",\"fontSize\":\"medium\"} -->\n<p class=\"has-text-align-center has-medium-font-size\">Aerogela is a focused aerogel directory and knowledge hub covering aerogel manufacturers, aerogel suppliers, silica aerogel applications, aerogel blanket products, and industrial insulation use cases worldwide.</p>\n<!-- /wp:paragraph -->\n\n<!-- wp:paragraph {\"align\":\"center\"} -->\n<p class=\"has-text-align-center\">Use the directory to compare <a href=\"https://aerogela.com/listing-category/aerogel-producers/\">aerogel producers</a>, browse <a href=\"https://aerogela.com/listing-category/distributors/\">aerogel distributors</a>, and read our <a href=\"https://aerogela.com/blog/\">aerogel blog</a> for practical guides on insulation, thermal management, supplier selection, and industrial applications.</p>\n<!-- /wp:paragraph -->\n\n<!-- wp:hivepress/listing-search-form /-->\n\n<!-- wp:spacer {\"height\":\"12px\"} -->\n<div style=\"height:12px\" aria-hidden=\"true\" class=\"wp-block-spacer\"></div>\n<!-- /wp:spacer -->\n\n<!-- wp:heading {\"textAlign\":\"center\",\"className\":\"content-title\"} -->\n<h2 class=\"wp-block-heading has-text-align-center content-title\">Top Aerogel Categories</h2>\n<!-- /wp:heading -->\n\n<!-- wp:paragraph {\"align\":\"center\"} -->\n<p class=\"has-text-align-center\">Explore global listings for aerogel materials manufacturers, industrial insulation distributors, equipment suppliers, and research organizations active in silica aerogel and related advanced materials.</p>\n<!-- /wp:paragraph -->\n\n<!-- wp:hivepress/listing-categories {\"columns\":\"4\",\"number\":\"4\"} /-->\n\n<!-- wp:heading {\"textAlign\":\"center\",\"className\":\"content-title\"} -->\n<h2 class=\"wp-block-heading has-text-align-center content-title\">Recent Aerogel Listings</h2>\n<!-- /wp:heading -->\n\n<!-- wp:paragraph {\"align\":\"center\"} -->\n<p class=\"has-text-align-center\">Discover newly added aerogel companies, including manufacturers, distributors, and specialized materials businesses serving industrial insulation, energy, construction, and thermal management markets.</p>\n<!-- /wp:paragraph -->\n\n<!-- wp:hivepress/listings {\"number\":\"6\"} /-->\n\n<!-- wp:heading {\"textAlign\":\"center\",\"className\":\"content-title\"} -->\n<h2 class=\"wp-block-heading has-text-align-center content-title\">Why Use Aerogela?</h2>\n<!-- /wp:heading -->\n\n<!-- wp:list -->\n<ul class=\"wp-block-list\"><!-- wp:list-item -->\n<li>Find aerogel manufacturers and suppliers by category.</li>\n<!-- /wp:list-item -->\n\n<!-- wp:list-item -->\n<li>Compare companies active in aerogel blanket, silica aerogel, and industrial insulation markets.</li>\n<!-- /wp:list-item -->\n\n<!-- wp:list-item -->\n<li>Read long-tail educational content that supports supplier research and product discovery.</li>\n<!-- /wp:list-item --></ul>\n<!-- /wp:list -->\n\n<!-- wp:heading {\"textAlign\":\"center\",\"className\":\"content-title\"} -->\n<h2 class=\"wp-block-heading has-text-align-center content-title\">Key Aerogel Markets</h2>\n<!-- /wp:heading -->\n\n<!-- wp:paragraph {\"align\":\"center\"} -->\n<p class=\"has-text-align-center\">Start with country and regional landing pages built from live Aerogela listings.</p>\n<!-- /wp:paragraph -->\n\n<!-- wp:list -->\n<ul class=\"wp-block-list\"><!-- wp:list-item -->\n<li><a href=\"https://aerogela.com/china-aerogel-companies/\">China Aerogel Companies</a></li>\n<!-- /wp:list-item -->\n\n<!-- wp:list-item -->\n<li><a href=\"https://aerogela.com/usa-aerogel-companies/\">USA Aerogel Companies</a></li>\n<!-- /wp:list-item -->\n\n<!-- wp:list-item -->\n<li><a href=\"https://aerogela.com/germany-aerogel-companies/\">Germany Aerogel Companies</a></li>\n<!-- /wp:list-item -->\n\n<!-- wp:list-item -->\n<li><a href=\"https://aerogela.com/canada-aerogel-companies/\">Canada Aerogel Companies</a></li>\n<!-- /wp:list-item -->\n\n<!-- wp:list-item -->\n<li><a href=\"https://aerogela.com/netherlands-aerogel-companies/\">Netherlands Aerogel Companies</a></li>\n<!-- /wp:list-item -->\n\n<!-- wp:list-item -->\n<li><a href=\"https://aerogela.com/belgium-aerogel-companies/\">Belgium Aerogel Companies</a></li>\n<!-- /wp:list-item -->\n\n<!-- wp:list-item -->\n<li><a href=\"https://aerogela.com/uk-aerogel-companies/\">UK Aerogel Companies</a></li>\n<!-- /wp:list-item -->\n\n<!-- wp:list-item -->\n<li><a href=\"https://aerogela.com/france-aerogel-companies/\">France Aerogel Companies</a></li>\n<!-- /wp:list-item --></ul>\n<!-- /wp:list -->\n\n<!-- wp:heading {\"textAlign\":\"center\",\"className\":\"content-title\"} -->\n<h2 class=\"wp-block-heading has-text-align-center content-title\">Country + Category Directories</h2>\n<!-- /wp:heading -->\n\n<!-- wp:list -->\n<ul class=\"wp-block-list\"><!-- wp:list-item -->\n<li><a href=\"https://aerogela.com/china-aerogel-manufacturers-directory/\">China Aerogel Manufacturers Directory</a></li>\n<!-- /wp:list-item -->\n\n<!-- wp:list-item -->\n<li><a href=\"https://aerogela.com/usa-aerogel-distributors-directory/\">USA Aerogel Distributors Directory</a></li>\n<!-- /wp:list-item -->\n\n<!-- wp:list-item -->\n<li><a href=\"https://aerogela.com/germany-aerogel-distributors-directory/\">Germany Aerogel Distributors Directory</a></li>\n<!-- /wp:list-item -->\n\n<!-- wp:list-item -->\n<li><a href=\"https://aerogela.com/canada-aerogel-distributors-directory/\">Canada Aerogel Distributors Directory</a></li>\n<!-- /wp:list-item -->\n\n<!-- wp:list-item -->\n<li><a href=\"https://aerogela.com/netherlands-aerogel-distributors-directory/\">Netherlands Aerogel Distributors Directory</a></li>\n<!-- /wp:list-item -->\n\n<!-- wp:list-item -->\n<li><a href=\"https://aerogela.com/belgium-aerogel-distributors-directory/\">Belgium Aerogel Distributors Directory</a></li>\n<!-- /wp:list-item -->\n\n<!-- wp:list-item -->\n<li><a href=\"https://aerogela.com/uk-aerogel-distributors-directory/\">UK Aerogel Distributors Directory</a></li>\n<!-- /wp:list-item -->\n\n<!-- wp:list-item -->\n<li><a href=\"https://aerogela.com/france-aerogel-companies-directory/\">France Aerogel Companies Directory</a></li>\n<!-- /wp:list-item --></ul>\n<!-- /wp:list -->\n\n<!-- wp:heading {\"textAlign\":\"center\",\"className\":\"content-title\"} -->\n<h2 class=\"wp-block-heading has-text-align-center content-title\">Product &amp; Application Directories</h2>\n<!-- /wp:heading -->\n\n<!-- wp:list -->\n<ul class=\"wp-block-list\"><!-- wp:list-item -->\n<li><a href=\"https://aerogela.com/aerogel-blanket-suppliers/\">Aerogel Blanket Suppliers</a></li>\n<!-- /wp:list-item -->\n\n<!-- wp:list-item -->\n<li><a href=\"https://aerogela.com/aerogel-powder-granules-suppliers/\">Aerogel Powder and Granules Suppliers</a></li>\n<!-- /wp:list-item -->\n\n<!-- wp:list-item -->\n<li><a href=\"https://aerogela.com/battery-thermal-pad-suppliers/\">Battery Thermal Pad Suppliers</a></li>\n<!-- /wp:list-item -->\n\n<!-- wp:list-item -->\n<li><a href=\"https://aerogela.com/aerogel-board-panel-suppliers/\">Aerogel Board and Panel Suppliers</a></li>\n<!-- /wp:list-item -->\n\n<!-- wp:list-item -->\n<li><a href=\"https://aerogela.com/industrial-insulation-aerogel-companies/\">Industrial Insulation Aerogel Companies</a></li>\n<!-- /wp:list-item -->\n\n<!-- wp:list-item -->\n<li><a href=\"https://aerogela.com/building-construction-aerogel-companies/\">Building and Construction Aerogel Companies</a></li>\n<!-- /wp:list-item -->\n\n<!-- wp:list-item -->\n<li><a href=\"https://aerogela.com/ev-battery-aerogel-companies/\">EV Battery Aerogel Companies</a></li>\n<!-- /wp:list-item -->\n\n<!-- wp:list-item -->\n<li><a href=\"https://aerogela.com/lng-cryogenic-aerogel-companies/\">LNG and Cryogenic Aerogel Companies</a></li>\n<!-- /wp:list-item --></ul>\n<!-- /wp:list -->\n\n<!-- wp:heading {\"textAlign\":\"center\",\"className\":\"content-title\"} -->\n<h2 class=\"wp-block-heading has-text-align-center content-title\">China Market Subdirectories</h2>\n<!-- /wp:heading -->\n\n<!-- wp:list -->\n<ul class=\"wp-block-list\"><!-- wp:list-item -->\n<li><a href=\"https://aerogela.com/china-industrial-insulation-aerogel-companies/\">China Industrial Insulation Aerogel Companies</a></li>\n<!-- /wp:list-item -->\n\n<!-- wp:list-item -->\n<li><a href=\"https://aerogela.com/china-ev-battery-aerogel-companies/\">China EV Battery Aerogel Companies</a></li>\n<!-- /wp:list-item -->\n\n<!-- wp:list-item -->\n<li><a href=\"https://aerogela.com/china-cryogenic-aerogel-companies/\">China Cryogenic Aerogel Companies</a></li>\n<!-- /wp:list-item -->\n\n<!-- wp:list-item -->\n<li><a href=\"https://aerogela.com/china-fire-protection-aerogel-companies/\">China Fire Protection Aerogel Companies</a></li>\n<!-- /wp:list-item -->\n\n<!-- wp:list-item -->\n<li><a href=\"https://aerogela.com/china-aerogel-blanket-suppliers/\">China Aerogel Blanket Suppliers</a></li>\n<!-- /wp:list-item -->\n\n<!-- wp:list-item -->\n<li><a href=\"https://aerogela.com/china-aerogel-powder-granules-suppliers/\">China Aerogel Powder and Granules Suppliers</a></li>\n<!-- /wp:list-item --></ul>\n<!-- /wp:list -->",
  "excerpt": "",
  "parent": "0"
}