{
  "slug": "laboratory-equipment-instruments-suppliers",
  "title": "Laboratory Equipment and Instruments for Aerogel R&D",
  "date": "Fri, 08 May 2026 09:47:27 +0000",
  "content": "<!-- wp:heading {\"level\":1} -->\n<h1>Laboratory Equipment and Instruments for Aerogel R&D</h1>\n<!-- /wp:heading -->\n<!-- wp:paragraph --><p>This page groups suppliers of laboratory equipment and instruments relevant to aerogel research, testing, porosity measurement, thermal-property analysis, powder handling, and advanced materials characterization.</p><!-- /wp:paragraph -->\n<!-- wp:paragraph --><p>Current directory count: <strong>15 listings</strong>. This page is designed to help buyers, researchers, engineers, and sourcing teams reach the most relevant live Aerogela profiles faster.</p><!-- /wp:paragraph -->\n<!-- wp:heading {\"level\":2} --><h2>Listed organizations</h2><!-- /wp:heading -->\n<!-- wp:list --><ul><li><a href=\"https://aerogela.com/listing/3p-instruments/\">3P Instruments</a></li>\n<li><a href=\"https://aerogela.com/listing/anton-paar/\">Anton Paar</a></li>\n<li><a href=\"https://aerogela.com/listing/bettersize-instruments/\">Bettersize Instruments</a></li>\n<li><a href=\"https://aerogela.com/listing/cem-corporation/\">CEM Corporation</a></li>\n<li><a href=\"https://aerogela.com/listing/hosokawamicron-corporation/\">HOSOKAWAMICRON CORPORATION</a></li>\n<li><a href=\"https://aerogela.com/listing/hiden-isochema/\">Hiden Isochema</a></li>\n<li><a href=\"https://aerogela.com/listing/hot-disk-ab/\">Hot Disk AB</a></li>\n<li><a href=\"https://aerogela.com/listing/linseis-messgeraete-gmbh/\">LINSEIS Messgeräte GmbH</a></li>\n<li><a href=\"https://aerogela.com/listing/mks-instruments/\">MKS Instruments</a></li>\n<li><a href=\"https://aerogela.com/listing/micromeritics-instrument-corp/\">Micromeritics Instrument Corp.</a></li>\n<li><a href=\"https://aerogela.com/listing/parr-instrument-company/\">Parr Instrument Company</a></li>\n<li><a href=\"https://aerogela.com/listing/retsch/\">RETSCH</a></li>\n<li><a href=\"https://aerogela.com/listing/setaram/\">SETARAM</a></li>\n<li><a href=\"https://aerogela.com/listing/surface-measurement-systems/\">Surface Measurement Systems</a></li>\n<li><a href=\"https://aerogela.com/listing/sympatec-gmbh/\">Sympatec GmbH</a></li></ul><!-- /wp:list -->\n<!-- wp:heading {\"level\":2} --><h2>How to use this page</h2><!-- /wp:heading -->\n<!-- wp:list --><ul><li>Open each company profile to review role, focus, and official website.</li><li>Compare whether the listing is best suited for sourcing, testing, R&amp;D, or process-scale work.</li><li>Use the listing-level Request Quote / Contact Supplier flow when outreach is needed.</li></ul><!-- /wp:list -->\n<!-- wp:heading {\"level\":2} --><h2>Related pages</h2><!-- /wp:heading -->\n<!-- wp:list --><ul><li><a href=\"https://aerogela.com/process-equipment-pilot-systems-suppliers/\">Process Equipment and Pilot Systems for Aerogel Production</a></li><li><a href=\"https://aerogela.com/testing-characterization-aerogel-services/\">Testing and Characterization for Aerogels</a></li><li><a href=\"https://aerogela.com/aerogel-blanket-suppliers/\">Aerogel Blanket Suppliers and Companies</a></li></ul><!-- /wp:list -->\n<!-- wp:heading {\"level\":2} --><h2>FAQ</h2><!-- /wp:heading -->\n<!-- wp:heading {\"level\":3} --><h3>What kinds of suppliers are listed here?</h3><!-- /wp:heading -->\n<!-- wp:paragraph --><p>Instrument makers, laboratory-equipment manufacturers, sorption-analysis vendors, thermal-analysis specialists, and particle-characterization suppliers tied to aerogel workflows.</p><!-- /wp:paragraph -->\n<!-- wp:heading {\"level\":3} --><h3>Is this page for production-scale hardware?</h3><!-- /wp:heading -->\n<!-- wp:paragraph --><p>Mostly no. This page focuses on laboratory and analytical infrastructure, while pilot and process systems are grouped separately.</p><!-- /wp:paragraph -->\n<!-- wp:heading {\"level\":3} --><h3>How can teams use this page?</h3><!-- /wp:heading -->\n<!-- wp:paragraph --><p>Use it to shortlist test and analysis vendors, compare technical fit, and open full listings for deeper research or contact actions.</p><!-- /wp:paragraph -->\n",
  "excerpt": "",
  "parent": "0"
}