{
  "slug": "lng-cryogenic-aerogel-companies",
  "title": "LNG and Cryogenic Aerogel Companies",
  "date": "Fri, 17 Apr 2026 11:32:12 +0000",
  "content": "<!-- wp:heading {\"level\":1} -->\n<h1 class=\"wp-block-heading\">LNG and Cryogenic Aerogel Companies</h1>\n<!-- /wp:heading -->\n\n<!-- wp:paragraph -->\n<p>This page groups companies relevant to LNG and cryogenic aerogel applications, where compact low-temperature insulation is commercially important. This page is built from live Aerogela listing taxonomies so users can find relevant suppliers faster.</p>\n<!-- /wp:paragraph -->\n\n<!-- wp:paragraph -->\n<p>Current directory count: <strong>8 listings</strong>. For market and educational context, also read <a href=\"https://aerogela.com/aerogel-for-cryogenic-insulation/\">the related guide on Aerogela</a> and continue through the <a href=\"https://aerogela.com/listings/\">main listings directory</a>.</p>\n<!-- /wp:paragraph -->\n\n<!-- wp:heading -->\n<h2 class=\"wp-block-heading\">Listed companies</h2>\n<!-- /wp:heading -->\n\n<!-- wp:list -->\n<ul>\n<li><a href=\"https://aerogela.com/listing/xiamen-namate-new-materials-technology/\">Xiamen Namate New Materials Technology Co., Ltd. | China Aerogel Manufacturer</a></li>\n<li><a href=\"https://aerogela.com/listing/shaanxi-mengchuang-nano-materials/\">Shaanxi Mengchuang Nano New Materials Co., Ltd. | China Aerogel Manufacturer</a></li>\n<li><a href=\"https://aerogela.com/listing/zhejiang-ugoo-technology/\">Zhejiang Ugoo Technology Co., Ltd. | China Aerogel Manufacturer</a></li>\n<li><a href=\"https://aerogela.com/listing/hebei-jinna-low-carbon-materials/\">Hebei Jinna Low-Carbon Materials Co., Ltd. | China Aerogel Manufacturer</a></li>\n<li><a href=\"https://aerogela.com/listing/zhongke-runzi-technology/\">Zhongke Runzi Technology Co., Ltd. | China Aerogel Manufacturer</a></li>\n<li><a href=\"https://aerogela.com/listing/sino-aerogel-zhongke-huaan/\">Sino-Aerogel (Zhongke Huaan) | China Aerogel Manufacturer</a></li>\n<li><a href=\"https://aerogela.com/listing/shanghai-aerogelzone-technology/\">Shanghai Aerogelzone Technology Co., Ltd. | China Aerogel Manufacturer</a></li>\n<li><a href=\"https://aerogela.com/listing/ibih-advanced-material-co-ltd/\">IBIH Advanced Materials Co., Ltd. | China Aerogel Manufacturer</a></li>\n</ul>\n<!-- /wp:list -->\n\n<!-- wp:heading -->\n<h2 class=\"wp-block-heading\">How to use this page</h2>\n<!-- /wp:heading -->\n\n<!-- wp:list -->\n<ul><li>Open company profiles to review positioning and official websites.</li><li>Compare supplier role, product format, and application fit.</li><li>Use the related guide to understand the wider product or application context.</li></ul>\n<!-- /wp:list -->\n\n<!-- wp:heading -->\n<h2 class=\"wp-block-heading\">FAQ</h2>\n<!-- /wp:heading -->\n<!-- wp:heading {\"level\":3} -->\n<h3 class=\"wp-block-heading\">What is this page for?</h3>\n<!-- /wp:heading -->\n<!-- wp:paragraph -->\n<p>This page helps users review Aerogela listings that match a specific aerogel product or application filter.</p>\n<!-- /wp:paragraph -->\n<!-- wp:heading {\"level\":3} -->\n<h3 class=\"wp-block-heading\">Are these all direct manufacturers?</h3>\n<!-- /wp:heading -->\n<!-- wp:paragraph -->\n<p>Not always. Depending on the filter, results may include producers, distributors, or other aerogel-relevant companies.</p>\n<!-- /wp:paragraph -->\n<!-- wp:heading {\"level\":3} -->\n<h3 class=\"wp-block-heading\">How should buyers use this list?</h3>\n<!-- /wp:heading -->\n<!-- wp:paragraph -->\n<p>Use the directory as a starting point, then review each listing and official source before procurement outreach.</p>\n<!-- /wp:paragraph -->",
  "excerpt": "",
  "parent": "0"
}