{
  "slug": "privacy-policy-2",
  "title": "Privacy Policy",
  "date": "Tue, 14 Apr 2026 13:00:11 +0000",
  "content": "<!-- wp:heading -->\n<h2>Privacy Policy</h2>\n<!-- /wp:heading -->\n\n<!-- wp:paragraph -->\n<p>This Privacy Policy describes how Aerogela (\"we,\" \"our,\" or \"us\") collects, uses, and protects your personal information when you visit our website at aerogela.com (the \"Site\").</p>\n<!-- /wp:paragraph -->\n\n<!-- wp:heading {\"level\":3} -->\n<h3>1. Information We Collect</h3>\n<!-- /wp:heading -->\n\n<!-- wp:paragraph -->\n<p>We may collect the following types of information:</p>\n<!-- /wp:paragraph -->\n\n<!-- wp:list -->\n<ul>\n<li><strong>Usage Data:</strong> We automatically collect certain information when you visit our Site, including your IP address, browser type, operating system, referring URLs, and information about how you interact with the Site.</li>\n<li><strong>Cookies:</strong> We use cookies and similar tracking technologies to track activity on our Site and hold certain information. You can instruct your browser to refuse all cookies or to indicate when a cookie is being sent.</li>\n<li><strong>Voluntary Information:</strong> If you submit a listing or contact us, we may collect your name, email address, company name, and any other information you choose to provide.</li>\n</ul>\n<!-- /wp:list -->\n\n<!-- wp:heading {\"level\":3} -->\n<h3>2. How We Use Your Information</h3>\n<!-- /wp:heading -->\n\n<!-- wp:paragraph -->\n<p>We use the information we collect to: operate and maintain our directory; improve your experience on the Site; respond to your inquiries and requests; send you updates about our services (if you have opted in); and comply with legal obligations.</p>\n<!-- /wp:paragraph -->\n\n<!-- wp:heading {\"level\":3} -->\n<h3>3. Information Sharing</h3>\n<!-- /wp:heading -->\n\n<!-- wp:paragraph -->\n<p>We do not sell, trade, or otherwise transfer your personal information to third parties without your consent, except as required by law or to trusted partners who assist us in operating the Site, conducting our business, or serving you, so long as those parties agree to keep this information confidential.</p>\n<!-- /wp:paragraph -->\n\n<!-- wp:heading {\"level\":3} -->\n<h3>4. Data Security</h3>\n<!-- /wp:heading -->\n\n<!-- wp:paragraph -->\n<p>We implement appropriate technical and organizational security measures to protect your personal information against unauthorized access, alteration, disclosure, or destruction. However, no method of transmission over the Internet or electronic storage is 100% secure.</p>\n<!-- /wp:paragraph -->\n\n<!-- wp:heading {\"level\":3} -->\n<h3>5. Third-Party Links</h3>\n<!-- /wp:heading -->\n\n<!-- wp:paragraph -->\n<p>Our Site may contain links to third-party websites. We are not responsible for the privacy practices or content of those sites. We encourage you to review the privacy policies of any third-party sites you visit.</p>\n<!-- /wp:paragraph -->\n\n<!-- wp:heading {\"level\":3} -->\n<h3>6. Your Rights</h3>\n<!-- /wp:heading -->\n\n<!-- wp:paragraph -->\n<p>You have the right to: access the personal information we hold about you; request correction of inaccurate data; request deletion of your data; and opt out of marketing communications at any time.</p>\n<!-- /wp:paragraph -->\n\n<!-- wp:heading {\"level\":3} -->\n<h3>7. Changes to This Policy</h3>\n<!-- /wp:heading -->\n\n<!-- wp:paragraph -->\n<p>We may update this Privacy Policy from time to time. We will notify you of any changes by posting the new Privacy Policy on this page and updating the \"Last updated\" date.</p>\n<!-- /wp:paragraph -->\n\n<!-- wp:heading {\"level\":3} -->\n<h3>8. Contact Us</h3>\n<!-- /wp:heading -->\n\n<!-- wp:paragraph -->\n<p>If you have any questions about this Privacy Policy, please contact us at <strong>contact@aerogela.com</strong>.</p>\n<!-- /wp:paragraph -->\n\n<!-- wp:paragraph -->\n<p><em>Last updated: April 2026</em></p>\n<!-- /wp:paragraph -->",
  "excerpt": "",
  "parent": "0"
}