{
  "slug": "france-aerogel-companies-directory",
  "title": "France Aerogel Companies Directory",
  "date": "Fri, 17 Apr 2026 11:11:47 +0000",
  "content": "<!-- wp:heading {\"level\":1} -->\n<h1 class=\"wp-block-heading\">France Aerogel Companies Directory</h1>\n<!-- /wp:heading -->\n\n<!-- wp:paragraph -->\n<p>This landing page collects live Aerogela listings for France filtered to aerogel companies. It is designed for buyers, researchers, and sourcing teams who want a faster path to country-specific supplier discovery.</p>\n<!-- /wp:paragraph -->\n\n<!-- wp:paragraph -->\n<p>Current directory count: <strong>1 listings</strong>. For broader market context, also read <a href=\"https://aerogela.com/france-aerogel-suppliers/\">our related France market guide</a> and browse the main <a href=\"https://aerogela.com/france-aerogel-companies/\">France aerogel companies page</a> when available.</p>\n<!-- /wp:paragraph -->\n\n<!-- wp:heading -->\n<h2 class=\"wp-block-heading\">Listed companies</h2>\n<!-- /wp:heading -->\n\n<!-- wp:list -->\n<ul>\n<li><a href=\"https://aerogela.com/listing/enersens/\">Enersens (Formerly Gu techno)</a></li>\n</ul>\n<!-- /wp:list -->\n\n<!-- wp:heading -->\n<h2 class=\"wp-block-heading\">How to use this page</h2>\n<!-- /wp:heading -->\n\n<!-- wp:list -->\n<ul><li>Open each company profile for details and official website links.</li><li>Compare supplier role, product focus, and market fit.</li><li>Use the companion market guide to understand the country-level aerogel landscape.</li></ul>\n<!-- /wp:list -->\n\n<!-- wp:heading -->\n<h2 class=\"wp-block-heading\">FAQ</h2>\n<!-- /wp:heading -->\n<!-- wp:heading {\"level\":3} -->\n<h3 class=\"wp-block-heading\">What is this directory page for?</h3>\n<!-- /wp:heading -->\n<!-- wp:paragraph -->\n<p>This page helps users review Aerogela listings in France that match the aerogel companies filter.</p>\n<!-- /wp:paragraph -->\n<!-- wp:heading {\"level\":3} -->\n<h3 class=\"wp-block-heading\">Does this page include every aerogel company in France?</h3>\n<!-- /wp:heading -->\n<!-- wp:paragraph -->\n<p>No. It includes companies currently listed on Aerogela that match the live taxonomy filters used for this page.</p>\n<!-- /wp:paragraph -->\n<!-- wp:heading {\"level\":3} -->\n<h3 class=\"wp-block-heading\">How should buyers use this list?</h3>\n<!-- /wp:heading -->\n<!-- wp:paragraph -->\n<p>Use it as a starting point for supplier research, then review each full listing and official website before contacting the company.</p>\n<!-- /wp:paragraph -->",
  "excerpt": "",
  "parent": "0"
}