{
  "slug": "germany-aerogel-companies",
  "title": "Germany Aerogel Companies and Suppliers",
  "date": "Fri, 17 Apr 2026 11:01:47 +0000",
  "content": "<!-- wp:heading {\"level\":1} -->\n<h1 class=\"wp-block-heading\">Germany Aerogel Companies and Suppliers</h1>\n<!-- /wp:heading -->\n\n<!-- wp:paragraph -->\n<p>Germany is a key European market for engineering-led aerogel sourcing, technical materials, and industrial insulation supply. This landing page groups live Aerogela listings tagged to Germany so buyers, researchers, and sourcing teams can review relevant companies more efficiently.</p>\n<!-- /wp:paragraph -->\n\n<!-- wp:paragraph -->\n<p>Currently indexed on this page: <strong>6 companies</strong>. For market context, also read <a href=\"https://aerogela.com/germany-aerogel-suppliers/\">our Germany aerogel market guide</a> and browse the broader <a href=\"https://aerogela.com/listing-category/aerogel-producers/\">Aerogel Producers</a> and <a href=\"https://aerogela.com/listing-category/distributors/\">Distributors</a> sections.</p>\n<!-- /wp:paragraph -->\n\n<!-- wp:heading -->\n<h2 class=\"wp-block-heading\">Listed companies in Germany</h2>\n<!-- /wp:heading -->\n\n<!-- wp:list -->\n<ul>\n<li><a href=\"https://aerogela.com/listing/carl-roth-gmbh-co-kg/\">Carl Roth GmbH + Co. KG</a></li>\n<li><a href=\"https://aerogela.com/listing/bcd-chemie-gmbh/\">BCD Chemie GmbH</a></li>\n<li><a href=\"https://aerogela.com/listing/aerogel-it-gmbh/\">Aerogel-it GmbH</a></li>\n<li><a href=\"https://aerogela.com/listing/krahn-chemie-gmbh/\">KRAHN Chemie GmbH</a></li>\n<li><a href=\"https://aerogela.com/listing/dlr-institute-of-materials-research/\">DLR Institute of Materials Research</a></li>\n<li><a href=\"https://aerogela.com/listing/basf-aerogel/\">BASF SE &#8211; Aerogel Solutions</a></li>\n</ul>\n<!-- /wp:list -->\n\n<!-- wp:heading -->\n<h2 class=\"wp-block-heading\">How to use this market page</h2>\n<!-- /wp:heading -->\n\n<!-- wp:list -->\n<ul><li>Review the listed companies and open their full profiles.</li><li>Compare manufacturer vs distributor positioning.</li><li>Use linked blog guides to understand regional market context before outreach.</li></ul>\n<!-- /wp:list -->\n\n<!-- wp:heading -->\n<h2 class=\"wp-block-heading\">FAQ</h2>\n<!-- /wp:heading -->\n\n<!-- wp:heading {\"level\":3} -->\n<h3 class=\"wp-block-heading\">What is this page for?</h3>\n<!-- /wp:heading -->\n<!-- wp:paragraph -->\n<p>This page groups Aerogela listings associated with Germany so users can review local companies and supplier options in one place.</p>\n<!-- /wp:paragraph -->\n\n<!-- wp:heading {\"level\":3} -->\n<h3 class=\"wp-block-heading\">Does this page include only manufacturers?</h3>\n<!-- /wp:heading -->\n<!-- wp:paragraph -->\n<p>No. Depending on the market, this page may include manufacturers, distributors, research organizations, or other aerogel-relevant companies listed on Aerogela.</p>\n<!-- /wp:paragraph -->\n\n<!-- wp:heading {\"level\":3} -->\n<h3 class=\"wp-block-heading\">How should buyers compare these companies?</h3>\n<!-- /wp:heading -->\n<!-- wp:paragraph -->\n<p>Use each profile to review supplier role, application focus, official website, and technical positioning before contacting the company directly.</p>\n<!-- /wp:paragraph -->",
  "excerpt": "",
  "parent": "0"
}