{
  "slug": "terms-of-use",
  "title": "Terms of Use",
  "date": "Tue, 14 Apr 2026 12:59:38 +0000",
  "content": "<!-- wp:heading -->\n<h2>Terms of Use</h2>\n<!-- /wp:heading -->\n\n<!-- wp:paragraph -->\n<p>Welcome to Aerogela (\"we,\" \"our,\" or \"us\"). By accessing or using our website at aerogela.com (the \"Site\"), you agree to be bound by these Terms of Use. If you do not agree with any part of these terms, please do not use our Site.</p>\n<!-- /wp:paragraph -->\n\n<!-- wp:heading {\"level\":3} -->\n<h3>1. Purpose of the Site</h3>\n<!-- /wp:heading -->\n\n<!-- wp:paragraph -->\n<p>Aerogela is an online directory dedicated to the global aerogel industry. We provide information about aerogel manufacturers, suppliers, distributors, equipment providers, and research institutions. Our listings are provided for informational purposes only and do not constitute endorsements or recommendations.</p>\n<!-- /wp:paragraph -->\n\n<!-- wp:heading {\"level\":3} -->\n<h3>2. Listing Accuracy</h3>\n<!-- /wp:heading -->\n\n<!-- wp:paragraph -->\n<p>We strive to maintain accurate and up-to-date information in our directory. However, we do not guarantee the completeness, accuracy, reliability, or currency of any listing content. Companies and organizations listed in our directory may change their products, services, or contact information without notice. We encourage users to verify information directly with the listed entities.</p>\n<!-- /wp:paragraph -->\n\n<!-- wp:heading {\"level\":3} -->\n<h3>3. User Conduct</h3>\n<!-- /wp:heading -->\n\n<!-- wp:paragraph -->\n<p>When using our Site, you agree not to: misuse the directory information for unsolicited commercial communications; submit false or misleading information; attempt to compromise the security or functionality of the Site; or use automated tools to scrape or collect data from the Site without our prior written permission.</p>\n<!-- /wp:paragraph -->\n\n<!-- wp:heading {\"level\":3} -->\n<h3>4. Disclaimer of Warranties</h3>\n<!-- /wp:heading -->\n\n<!-- wp:paragraph -->\n<p>The Site is provided on an \"as is\" and \"as available\" basis. We make no warranties, expressed or implied, regarding the Site's operation or the information, content, or materials included. We do not warrant that the Site will be uninterrupted, error-free, or free of viruses or other harmful components.</p>\n<!-- /wp:paragraph -->\n\n<!-- wp:heading {\"level\":3} -->\n<h3>5. Limitation of Liability</h3>\n<!-- /wp:heading -->\n\n<!-- wp:paragraph -->\n<p>In no event shall Aerogela, its directors, employees, or agents be liable for any direct, indirect, incidental, special, or consequential damages arising from your use of the Site or reliance on any information obtained through the Site.</p>\n<!-- /wp:paragraph -->\n\n<!-- wp:heading {\"level\":3} -->\n<h3>6. Changes to Terms</h3>\n<!-- /wp:heading -->\n\n<!-- wp:paragraph -->\n<p>We reserve the right to modify these Terms of Use at any time. Changes will be effective immediately upon posting on the Site. Your continued use of the Site after any changes constitutes acceptance of the new terms.</p>\n<!-- /wp:paragraph -->\n\n<!-- wp:heading {\"level\":3} -->\n<h3>7. Contact</h3>\n<!-- /wp:heading -->\n\n<!-- wp:paragraph -->\n<p>If you have questions about these Terms of Use, please contact us at <strong>contact@aerogela.com</strong>.</p>\n<!-- /wp:paragraph -->\n\n<!-- wp:paragraph -->\n<p><em>Last updated: April 2026</em></p>\n<!-- /wp:paragraph -->",
  "excerpt": "",
  "parent": "0"
}