{
  "slug": "testing-characterization-aerogel-services",
  "title": "Testing and Characterization for Aerogels",
  "date": "Fri, 08 May 2026 09:47:25 +0000",
  "content": "<!-- wp:heading {\"level\":1} -->\n<h1>Testing and Characterization for Aerogels</h1>\n<!-- /wp:heading -->\n<!-- wp:paragraph --><p>This page collects Aerogela listings relevant to aerogel testing, metrology, porosity analysis, thermal-property measurement, and broader characterization workflows used in advanced materials programs.</p><!-- /wp:paragraph -->\n<!-- wp:paragraph --><p>Current directory count: <strong>44 listings</strong>. This page is designed to help buyers, researchers, engineers, and sourcing teams reach the most relevant live Aerogela profiles faster.</p><!-- /wp:paragraph -->\n<!-- wp:heading {\"level\":2} --><h2>Listed organizations</h2><!-- /wp:heading -->\n<!-- wp:list --><ul><li><a href=\"https://aerogela.com/listing/3p-instruments/\">3P Instruments</a></li>\n<li><a href=\"https://aerogela.com/listing/aerogel-technologies/\">Aerogel Technologies LLC</a></li>\n<li><a href=\"https://aerogela.com/listing/anton-paar/\">Anton Paar</a></li>\n<li><a href=\"https://aerogela.com/listing/bre-group/\">BRE Group</a></li>\n<li><a href=\"https://aerogela.com/listing/bettersize-instruments/\">Bettersize Instruments</a></li>\n<li><a href=\"https://aerogela.com/listing/cem-corporation/\">CEM Corporation</a></li>\n<li><a href=\"https://aerogela.com/listing/canadian-light-source/\">Canadian Light Source</a></li>\n<li><a href=\"https://aerogela.com/listing/center-for-functional-nanomaterials/\">Center for Functional Nanomaterials</a></li>\n<li><a href=\"https://aerogela.com/listing/characterization-facility-university-of-minnesota/\">Characterization Facility, University of Minnesota</a></li>\n<li><a href=\"https://aerogela.com/listing/china-building-materials-industry-key-laboratory-of-aerogel-materials-nanjing-tech-university/\">China Building Materials Industry Key Laboratory of Aerogel Materials, Nanjing Tech University</a></li>\n<li><a href=\"https://aerogela.com/listing/college-of-materials-science-and-engineering-donghua-university/\">College of Materials Science and Engineering, Donghua University</a></li>\n<li><a href=\"https://aerogela.com/listing/cornell-center-for-materials-research-shared-facilities/\">Cornell Center for Materials Research Shared Facilities</a></li>\n<li><a href=\"https://aerogela.com/listing/dlr-institute-of-materials-research/\">DLR Institute of Materials Research</a></li>\n<li><a href=\"https://aerogela.com/listing/fiw-m-nchen/\">FIW München</a></li>\n<li><a href=\"https://aerogela.com/listing/fraunhofer-institute-for-building-physics-ibp/\">Fraunhofer Institute for Building Physics IBP</a></li>\n<li><a href=\"https://aerogela.com/listing/fraunhofer-institute-for-manufacturing-technology-and-advanced-materials-ifam/\">Fraunhofer Institute for Manufacturing Technology and Advanced Materials IFAM</a></li>\n<li><a href=\"https://aerogela.com/listing/hosokawamicron-corporation/\">HOSOKAWAMICRON CORPORATION</a></li>\n<li><a href=\"https://aerogela.com/listing/hefei-institutes-of-physical-science-chinese-academy-of-sciences/\">Hefei Institutes of Physical Science, Chinese Academy of Sciences</a></li>\n<li><a href=\"https://aerogela.com/listing/hiden-isochema/\">Hiden Isochema</a></li>\n<li><a href=\"https://aerogela.com/listing/hot-disk-ab/\">Hot Disk AB</a></li>\n<li><a href=\"https://aerogela.com/listing/institute-of-chemistry-chinese-academy-of-sciences/\">Institute of Chemistry, Chinese Academy of Sciences</a></li>\n<li><a href=\"https://aerogela.com/listing/institute-of-metal-research-chinese-academy-of-sciences/\">Institute of Metal Research, Chinese Academy of Sciences</a></li>\n<li><a href=\"https://aerogela.com/listing/key-laboratory-of-rubber-plastics-qingdao-university-of-science-and-technology/\">Key Laboratory of Rubber-Plastics, Qingdao University of Science and Technology</a></li>\n<li><a href=\"https://aerogela.com/listing/key-laboratory-of-synthetic-and-biological-colloids-jiangnan-university/\">Key Laboratory of Synthetic and Biological Colloids, Jiangnan University</a></li>\n<li><a href=\"https://aerogela.com/listing/linseis-messgeraete-gmbh/\">LINSEIS Messgeräte GmbH</a></li>\n<li><a href=\"https://aerogela.com/listing/mks-instruments/\">MKS Instruments</a></li>\n<li><a href=\"https://aerogela.com/listing/micromeritics-instrument-corp/\">Micromeritics Instrument Corp.</a></li>\n<li><a href=\"https://aerogela.com/listing/molecular-foundry/\">Molecular Foundry</a></li>\n<li><a href=\"https://aerogela.com/listing/nist-center-for-nanoscale-science-and-technology-nanofab/\">NIST Center for Nanoscale Science and Technology NanoFab</a></li>\n<li><a href=\"https://aerogela.com/listing/nist-center-for-neutron-research/\">NIST Center for Neutron Research</a></li>\n<li><a href=\"https://aerogela.com/listing/nuance-center/\">NUANCE Center</a></li>\n<li><a href=\"https://aerogela.com/listing/national-key-laboratory-of-advanced-pulp-and-paper-technology-and-materials-south-china-university-of-technology/\">National Key Laboratory of Advanced Pulp and Paper Technology and Materials, South China University of Technology</a></li>\n<li><a href=\"https://aerogela.com/listing/national-physical-laboratory/\">National Physical Laboratory</a></li>\n<li><a href=\"https://aerogela.com/listing/retsch/\">RETSCH</a></li>\n<li><a href=\"https://aerogela.com/listing/rise-research-institutes-of-sweden/\">RISE Research Institutes of Sweden</a></li>\n<li><a href=\"https://aerogela.com/listing/setaram/\">SETARAM</a></li>\n<li><a href=\"https://aerogela.com/listing/shanghai-institute-of-ceramics-chinese-academy-of-sciences/\">Shanghai Institute of Ceramics, Chinese Academy of Sciences</a></li>\n<li><a href=\"https://aerogela.com/listing/surface-measurement-systems/\">Surface Measurement Systems</a></li>\n<li><a href=\"https://aerogela.com/listing/suzhou-institute-of-nano-tech-and-nano-bionics-chinese-academy-of-sciences/\">Suzhou Institute of Nano-Tech and Nano-Bionics, Chinese Academy of Sciences</a></li>\n<li><a href=\"https://aerogela.com/listing/sympatec-gmbh/\">Sympatec GmbH</a></li>\n<li><a href=\"https://aerogela.com/listing/tno/\">TNO</a></li>\n<li><a href=\"https://aerogela.com/listing/technical-institute-of-physics-and-chemistry-chinese-academy-of-sciences/\">Technical Institute of Physics and Chemistry, Chinese Academy of Sciences</a></li>\n<li><a href=\"https://aerogela.com/listing/technology-research-institute-wuhan-textile-university/\">Technology Research Institute, Wuhan Textile University</a></li>\n<li><a href=\"https://aerogela.com/listing/nanofab-university-of-alberta/\">nanoFAB, University of Alberta</a></li></ul><!-- /wp:list -->\n<!-- wp:heading {\"level\":2} --><h2>How to use this page</h2><!-- /wp:heading -->\n<!-- wp:list --><ul><li>Open each company profile to review role, focus, and official website.</li><li>Compare whether the listing is best suited for sourcing, testing, R&amp;D, or process-scale work.</li><li>Use the listing-level Request Quote / Contact Supplier flow when outreach is needed.</li></ul><!-- /wp:list -->\n<!-- wp:heading {\"level\":2} --><h2>Related pages</h2><!-- /wp:heading -->\n<!-- wp:list --><ul><li><a href=\"https://aerogela.com/materials-research-development-aerogel-services/\">Materials Research and Development for Aerogels</a></li><li><a href=\"https://aerogela.com/laboratory-equipment-instruments-suppliers/\">Laboratory Equipment and Instruments for Aerogel R&D</a></li><li><a href=\"https://aerogela.com/contact-supplier/\">Request Quote / Contact Supplier</a></li></ul><!-- /wp:list -->\n<!-- wp:heading {\"level\":2} --><h2>FAQ</h2><!-- /wp:heading -->\n<!-- wp:heading {\"level\":3} --><h3>What kinds of organizations appear here?</h3><!-- /wp:heading -->\n<!-- wp:paragraph --><p>Expect testing facilities, national labs, university platforms, sorption-instrument vendors, thermal-analysis vendors, and other advanced materials characterization resources.</p><!-- /wp:paragraph -->\n<!-- wp:heading {\"level\":3} --><h3>Is this page limited to aerogel manufacturers?</h3><!-- /wp:heading -->\n<!-- wp:paragraph --><p>No. It is designed to surface the broader ecosystem needed to measure and validate aerogel materials.</p><!-- /wp:paragraph -->\n<!-- wp:heading {\"level\":3} --><h3>How should users act on this page?</h3><!-- /wp:heading -->\n<!-- wp:paragraph --><p>Use it to identify the right testing or instrumentation partner, then open the full listing to review details and contact pathways.</p><!-- /wp:paragraph -->\n",
  "excerpt": "",
  "parent": "0"
}