{
  "slug": "china-aerogel-blanket-suppliers",
  "title": "China Aerogel Blanket Suppliers",
  "date": "Fri, 17 Apr 2026 11:37:52 +0000",
  "content": "<!-- wp:heading {\"level\":1} -->\n<h1 class=\"wp-block-heading\">China Aerogel Blanket Suppliers</h1>\n<!-- /wp:heading -->\n\n<!-- wp:paragraph -->\n<p>This page focuses on China-based suppliers and manufacturers relevant to aerogel insulation blanket products. It is generated from live Aerogela taxonomy data so the listing set stays aligned with the directory structure.</p>\n<!-- /wp:paragraph -->\n\n<!-- wp:paragraph -->\n<p>Current directory count: <strong>18 listings</strong>. For broader context, also read <a href=\"https://aerogela.com/aerogel-blanket-applications/\">the related Aerogela guide</a> and browse the <a href=\"https://aerogela.com/china-aerogel-companies/\">main China aerogel companies page</a>.</p>\n<!-- /wp:paragraph -->\n\n<!-- wp:heading -->\n<h2 class=\"wp-block-heading\">Listed companies</h2>\n<!-- /wp:heading -->\n\n<!-- wp:list -->\n<ul>\n<li><a href=\"https://aerogela.com/listing/hubei-xingfa-chemicals-aerogel/\">Hubei Xingfa Chemicals Group Co., Ltd. | China Aerogel Materials Manufacturer</a></li>\n<li><a href=\"https://aerogela.com/listing/winsell-energy-saving-group-aerogel/\">Winsell Energy Saving Group Co., Ltd. | China Aerogel Materials Manufacturer</a></li>\n<li><a href=\"https://aerogela.com/listing/xiamen-namate-new-materials-technology/\">Xiamen Namate New Materials Technology Co., Ltd. | China Aerogel Manufacturer</a></li>\n<li><a href=\"https://aerogela.com/listing/shanghai-grandnew-materials-technology/\">Shanghai Grandnew Materials Technology Co., Ltd. | China Aerogel Manufacturer</a></li>\n<li><a href=\"https://aerogela.com/listing/zhejiang-ugoo-technology/\">Zhejiang Ugoo Technology Co., Ltd. | China Aerogel Manufacturer</a></li>\n<li><a href=\"https://aerogela.com/listing/hebei-jinna-low-carbon-materials/\">Hebei Jinna Low-Carbon Materials Co., Ltd. | China Aerogel Manufacturer</a></li>\n<li><a href=\"https://aerogela.com/listing/shenzhen-zhongning-technology/\">Shenzhen Zhongning Technology Co., Ltd. | China Aerogel Manufacturer</a></li>\n<li><a href=\"https://aerogela.com/listing/zhongke-runzi-technology/\">Zhongke Runzi Technology Co., Ltd. | China Aerogel Manufacturer</a></li>\n<li><a href=\"https://aerogela.com/listing/gongyi-van-research-composite-material/\">Gongyi Van-Research Composite Material Co., Ltd. | China Aerogel Manufacturer</a></li>\n<li><a href=\"https://aerogela.com/listing/anhui-key-nano-new-material-technology/\">Anhui Key-Nano New Material Technology Co., Ltd. | China Aerogel Manufacturer</a></li>\n<li><a href=\"https://aerogela.com/listing/jiangsu-jiayun-new-materials/\">Jiangsu Jiayun New Materials Co., Ltd. | China Aerogel Manufacturer</a></li>\n<li><a href=\"https://aerogela.com/listing/zhengzhou-exceed-new-materials/\">Zhengzhou Exceed New Technologies Co., Ltd. | China Aerogel Manufacturer</a></li>\n<li><a href=\"https://aerogela.com/listing/shanghai-aerogelzone-technology/\">Shanghai Aerogelzone Technology Co., Ltd. | China Aerogel Manufacturer</a></li>\n<li><a href=\"https://aerogela.com/listing/hong-hitech-beijing-co-ltd/\">Hong Hitech (Beijing) Co., Ltd. | China Aerogel Manufacturer</a></li>\n<li><a href=\"https://aerogela.com/listing/ningbo-surnano-aerogel-co-ltd/\">Ningbo Surnano Aerogel Co., Ltd. | China Aerogel Manufacturer</a></li>\n<li><a href=\"https://aerogela.com/listing/ibih-advanced-material-co-ltd/\">IBIH Advanced Materials Co., Ltd. | China Aerogel Manufacturer</a></li>\n<li><a href=\"https://aerogela.com/listing/guangdong-alison-hi-tech-co-ltd/\">Guangdong Alison Technology Co., Ltd. | China Aerogel Manufacturer</a></li>\n<li><a href=\"https://aerogela.com/listing/nano-high-tech/\">Nano High-Tech Co., Ltd. | China Aerogel Manufacturer</a></li>\n</ul>\n<!-- /wp:list -->\n\n<!-- wp:heading -->\n<h2 class=\"wp-block-heading\">FAQ</h2>\n<!-- /wp:heading -->\n<!-- wp:heading {\"level\":3} -->\n<h3 class=\"wp-block-heading\">What is this page for?</h3>\n<!-- /wp:heading -->\n<!-- wp:paragraph -->\n<p>This page helps users review China-based Aerogela listings that match a specific product or application filter.</p>\n<!-- /wp:paragraph -->\n<!-- wp:heading {\"level\":3} -->\n<h3 class=\"wp-block-heading\">Are these all direct manufacturers?</h3>\n<!-- /wp:heading -->\n<!-- wp:paragraph -->\n<p>Not always. Depending on the taxonomy match, the results may include producers, distributors, or other relevant companies.</p>\n<!-- /wp:paragraph -->\n<!-- wp:heading {\"level\":3} -->\n<h3 class=\"wp-block-heading\">How should buyers use this list?</h3>\n<!-- /wp:heading -->\n<!-- wp:paragraph -->\n<p>Use it as a starting point for supplier discovery, then inspect each company profile and official website before outreach.</p>\n<!-- /wp:paragraph -->",
  "excerpt": "",
  "parent": "0"
}