{
  "slug": "how-listings-are-reviewed",
  "title": "How Listings Are Reviewed",
  "date": "Sat, 09 May 2026 00:09:46 +0000",
  "content": "<h1>How Listings Are Reviewed</h1>\n<p>Aerogela is an editorial directory. We review listings using publicly available information and selected first-party submissions to improve directory quality, reduce obvious errors, and help users understand the current confidence level of each profile.</p>\n<h2>Typical review inputs</h2>\n<ul>\n<li>Official company or institution websites</li>\n<li>Public product, application, or service pages</li>\n<li>Public contact and location details</li>\n<li>Claim requests and submit-listing information provided through Aerogela workflows</li>\n<li>Internal editorial classification of category, main products, and application fields</li>\n</ul>\n<h2>What we usually check</h2>\n<ul>\n<li>Whether the organization appears active and relevant to the aerogel ecosystem</li>\n<li>Whether the website and public identity match the listing title</li>\n<li>Whether the category, location, and core offering look directionally correct</li>\n<li>Whether the listing needs correction, consolidation, or removal</li>\n</ul>\n<h2>Review statuses</h2>\n<h3>Reviewed</h3>\n<p>A <strong>Reviewed</strong> listing has been checked by Aerogela using editorial review of public information. This means the profile has received a manual quality pass, but it does not mean the business has been independently certified by a third-party authority.</p>\n<h3>Verified</h3>\n<p>A <strong>Verified</strong> listing has stronger confirmation than a standard reviewed profile. In practice this may include a successful claim flow, direct confirmation from the representative, or other higher-confidence validation signals available to the directory.</p>\n<h2>What review does not guarantee</h2>\n<ul>\n<li>Commercial quality, technical suitability, or pricing competitiveness</li>\n<li>Regulatory, safety, export-control, or procurement compliance</li>\n<li>That all information will remain current after publication</li>\n</ul>\n<h2>Requesting an update</h2>\n<p>If you represent a listed company and would like to improve or correct a profile, use one of these workflows:</p>\n<ul>\n<li><a href=\"https://aerogela.com/claim-listing/\">Claim Listing</a></li>\n<li><a href=\"https://aerogela.com/submit-a-listing/\">Submit a Listing</a></li>\n<li><a href=\"https://aerogela.com/contact-supplier/\">Request Quote / Contact Supplier</a> for communication support</li>\n</ul>",
  "excerpt": "",
  "parent": "0"
}