{
  "slug": "china-cryogenic-aerogel-companies",
  "title": "China Cryogenic Aerogel Companies",
  "date": "Fri, 17 Apr 2026 11:37:44 +0000",
  "content": "<!-- wp:heading {\"level\":1} -->\n<h1 class=\"wp-block-heading\">China Cryogenic Aerogel Companies</h1>\n<!-- /wp:heading -->\n\n<!-- wp:paragraph -->\n<p>This page groups China-based aerogel companies relevant to LNG and cryogenic systems, where compact low-temperature insulation is commercially important. It is generated from live Aerogela taxonomy data so the listing set stays aligned with the directory structure.</p>\n<!-- /wp:paragraph -->\n\n<!-- wp:paragraph -->\n<p>Current directory count: <strong>8 listings</strong>. For broader context, also read <a href=\"https://aerogela.com/aerogel-for-cryogenic-insulation/\">the related Aerogela guide</a> and browse the <a href=\"https://aerogela.com/china-aerogel-companies/\">main China aerogel companies page</a>.</p>\n<!-- /wp:paragraph -->\n\n<!-- wp:heading -->\n<h2 class=\"wp-block-heading\">Listed companies</h2>\n<!-- /wp:heading -->\n\n<!-- wp:list -->\n<ul>\n<li><a href=\"https://aerogela.com/listing/xiamen-namate-new-materials-technology/\">Xiamen Namate New Materials Technology Co., Ltd. | China Aerogel Manufacturer</a></li>\n<li><a href=\"https://aerogela.com/listing/shaanxi-mengchuang-nano-materials/\">Shaanxi Mengchuang Nano New Materials Co., Ltd. | China Aerogel Manufacturer</a></li>\n<li><a href=\"https://aerogela.com/listing/zhejiang-ugoo-technology/\">Zhejiang Ugoo Technology Co., Ltd. | China Aerogel Manufacturer</a></li>\n<li><a href=\"https://aerogela.com/listing/hebei-jinna-low-carbon-materials/\">Hebei Jinna Low-Carbon Materials Co., Ltd. | China Aerogel Manufacturer</a></li>\n<li><a href=\"https://aerogela.com/listing/zhongke-runzi-technology/\">Zhongke Runzi Technology Co., Ltd. | China Aerogel Manufacturer</a></li>\n<li><a href=\"https://aerogela.com/listing/sino-aerogel-zhongke-huaan/\">Sino-Aerogel (Zhongke Huaan) | China Aerogel Manufacturer</a></li>\n<li><a href=\"https://aerogela.com/listing/shanghai-aerogelzone-technology/\">Shanghai Aerogelzone Technology Co., Ltd. | China Aerogel Manufacturer</a></li>\n<li><a href=\"https://aerogela.com/listing/ibih-advanced-material-co-ltd/\">IBIH Advanced Materials Co., Ltd. | China Aerogel Manufacturer</a></li>\n</ul>\n<!-- /wp:list -->\n\n<!-- wp:heading -->\n<h2 class=\"wp-block-heading\">FAQ</h2>\n<!-- /wp:heading -->\n<!-- wp:heading {\"level\":3} -->\n<h3 class=\"wp-block-heading\">What is this page for?</h3>\n<!-- /wp:heading -->\n<!-- wp:paragraph -->\n<p>This page helps users review China-based Aerogela listings that match a specific product or application filter.</p>\n<!-- /wp:paragraph -->\n<!-- wp:heading {\"level\":3} -->\n<h3 class=\"wp-block-heading\">Are these all direct manufacturers?</h3>\n<!-- /wp:heading -->\n<!-- wp:paragraph -->\n<p>Not always. Depending on the taxonomy match, the results may include producers, distributors, or other relevant companies.</p>\n<!-- /wp:paragraph -->\n<!-- wp:heading {\"level\":3} -->\n<h3 class=\"wp-block-heading\">How should buyers use this list?</h3>\n<!-- /wp:heading -->\n<!-- wp:paragraph -->\n<p>Use it as a starting point for supplier discovery, then inspect each company profile and official website before outreach.</p>\n<!-- /wp:paragraph -->",
  "excerpt": "",
  "parent": "0"
}